id,program_name,category_primary,description,url_pdf,age_min,age_max,income_type,income_max,household_size,residence_required,employment_status,house_type,special_conditions,support_type,support_amount,support_duration,support_details,application_period,how_to_apply,contact,difficulty_level,raw_text
1,서울형 청년인턴 직무캠프,일자리,서울시-기업 협업으로 청년 직무역량 교육(사전직무교육·직장적응교육)과 인턴십(4개월)을 제공하고 취업을 연계하는 사업,uploaded:/mnt/data/2025년-서울형-청년인턴-직무캠프-참여자-모집-공고문.pdf,18.0,34.0,해당없음,null,null,서울시 거주,"구직자(미취업)만 가능, 재·휴학자 제외(졸업예정자는 가능)",null,"외국인: 서울 소재 대학 졸업, D-10, 체류기간 2025-12-31까지, 인턴 4개월 가능, TOPIK 4~6급. 우대: 기초생활·차상위·한부모·북한이탈·장애·보훈취업지원·자립준비청년, 쉼터퇴소/가정밖/청소년부모/가족돌봄/중도입국청소년 등",교육·인턴십·임금,"시급 11,779원(서울형생활임금), 월급여는 근무일수 등에 따라 상이, 4대보험","사전직무교육 80~100시간, 직장적응교육 20시간, 인턴십 4개월(7~10월 예정)","예치금 10만원(교육 80% 이상 수료 시 환급), 근로시간 1일 8시간/주40시간, 연장·야간·휴일근로 원칙적 금지(예외시 가산수당·휴일대체), 근로계약은 서울시-청년인턴 간 체결",2025-04-01 10:00 ~ 2025-04-14 17:00,"직무분야별 운영기관 채널 접수: 경영사무 https://vo.la/WskKXD, 영업·광고·마케팅 https://miniintern.com/event/2881, 국제협력 https://seoul.ninehire.site","경영사무 02-6262-9354(9707), 02-2133-9344(9346); 영업광고마케팅 010-4670-3056, 02-2133-5523(9343); 국제협력 02-760-8818(8820), 02-2133-9350; 공통 이메일 amore@seoul.go.kr",3,"지원대상: 18~34세 서울시 거주 청년 270명. 내용: 사전직무교육·직장적응교육·인턴십(4개월)·취업연계. 선발: 서류→역량→면접. 신청: 2025-04-01~04-14. 임금: 시급 11,779원. (자세한 내용은 원문 참조)"
2,2025년 서울시 청년 골목창업 경진대회,창업(선택),예비·초기 청년창업가 대상 경진대회: 시연·컨설팅·창업자금·네트워킹 제공,uploaded:/mnt/data/2025년 서울시 청년 골목창업 경진대회 모집공고문.pdf,19.0,39.0,null,null,null,예비: 서울 거주 / 초기: 사업장 서울,예비창업가 또는 창업 3년 미만 초기창업가,null,의무복무 제대군인 최대 3년 연령 상한 연장,창업자금·융자·컨설팅·네트워킹,"창업자금 최대 1,600만원(예비), 1,700만원(초기); 융자 최대 7,000만원","오리엔테이션(6/23), 1차 경진(7/7~8), 2차 경진(10/20) 등 7~10월 진행","재무회계·브랜드 컨설팅, 현장 워크숍, 로컬인사이트 투어, 선배창업가 특강",2025-04-28 10:00 ~ 2025-05-16 17:00,온라인 신청(originality-seoul.kr),"운영사무국 originality-seoul@urbanplay.co.kr, 010-9781-3639",3,골목상권 내 생활밀접업종 창업 준비 중 또는 3년 미만. 단계별 경진대회 및 자금 차등지원.
3,2025년 서울시 청년 마음건강 지원사업(4차),심리건강,"19~39세 서울 청년 대상 맞춤형 심리상담(간이검사, 6회기 자기이해 상담 등)",uploaded:/mnt/data/2025년 서울시 청년 마음건강 지원사업 4차 참여자 모집 공고.pdf,19.0,39.0,null,null,null,서울 거주,null,null,제대군인 복무기간 만큼 연령 상한 연장 가능,심리검사·상담,"KSCL95 간이검사 무료, 1:1 상담 6회기 제공","검사→분석→상담배정→6회기 상담, 12월 14일까지","TCI 검사 안내, 유형군 분류에 따른 맞춤 프로그램",2025-09-04 10:00 ~ 2025-09-11 17:00,청년몽땅정보통(youth.seoul.go.kr) 온라인 신청,"서울시 다산콜센터 120, 청년몽땅정보통",2,선정 후 플랫폼 접속·검사·사전설문·상담 배정 및 1:1 상담 6회기.
4,2025년 서울형 강소기업 신규 모집,일자리,서울 소재 공공기관 인증 중소기업을 ‘서울형 강소기업’으로 선정(청년고용·복지·워라밸 우수),uploaded:/mnt/data/2025년 서울형 강소기업 신규 모집 공고.pdf,null,null,null,null,null,서울 소재(본사) 공공기관 인증 중소기업,기업 신청(업력 2년 이상),null,null,인증·근무환경개선금·교육·금융우대,"근무환경개선금 최대 4,500만원(청년 채용 시 1인 1,500만원, 최대 3명) 등",인증 유효기간 2026-01-01 ~ 2027-12-31(2년),"온보딩·조직문화 교육, 일·생활균형 컨설팅, 방송광고비 할인, 대출 금리 우대",2025-06-02 10:00 ~ 2025-06-30 18:00,"seouljobnow.co.kr 온라인 신청, 원클릭시스템(NICE) 서류 제출","서울시 일자리정책과 02-2133-5474/5520/5444, NICE 고객센터 02-3771-1050",4,사전심사→현장실사→종합심사→최종선정. 선정기업에 각종 지원 제공.
5,서울 청년 예비인턴 사업,일자리,대학(원) 재·휴학생 청년 대상 직무교육 후 4개월 인턴 근무 제공,uploaded:/mnt/data/서울 청년 예비인턴 사업 참여자 모집 공고.pdf,19.0,39.0,null,null,null,서울 거주 또는 서울 소재 대학(원) 재·휴학,대학(원) 재·휴학생(졸업생 참여 불가),null,"제대군인 연령 상한 연장 가능, 우대: 취업취약계층·청년부상 제대군인·4학기 이상",교육·인턴십·임금,"시급 11,779원, 월 최대 2,461,810원(4대보험 포함)","사전교육 7/16~7/31, 인턴 8~11월(4개월)","1일 8시간 주5일, 주휴·4대보험, 서울시가 월 1회 직접 지급",2025-06-02 ~ 2025-06-16 18:00,청년몽땅정보통(youth.seoul.go.kr) 온라인 신청,"운영사무국 02-2275-2558, 서울시 청년정책담당관 02-2133-4308",3,"서류→AI역량검사→면접. 발대식·교육 필참, 각 기업 사업장 배치 근무."
6,2025 서울시 고립 은둔청년 지원사업,심리건강,고립·은둔 청년의 심리지원과 사회복귀를 돕는 맞춤 프로그램 제공(상시 모집).,https://youth.seoul.go.kr/youthConts.do?key=2310100062&sc_pbancSeCd=008&sc_bbsStngSn=2212200001&sc_bbsCtgrySn=2310200007&sc_qnaCtgryCd=&sc_faqCtgryCd=013,19.0,39.0,null,null,null,서울 거주,제한없음,null,"가족 참여 가능, 제대군인 복무기간만큼 연령 상한 연장",심리상담·맞춤프로그램,null,"사업 운영 2025-01-01~ (상시), 상담 6개월 이상 경과 기준 충족 시 프로그램 배정","심리지원 및 마음건강 정책 연계, 진로탐색/취업역량/대인관계 강화, 활동·체험/온라인 상호작용, 생활습관 형성, 공동생활·방문상담(소규모), 부모교육·멘토양성(별도 모집)",2025-01-01 ~ (상시),청년몽땅정보통 로그인 → 복지 지원 → 고립은둔청년 지원 → 자가확인·동의·신청서·설문 → 개별면접,서울청년기지개센터 02-6953-2520,2,"정의/자격: 서울 거주 만19~39세 고립·은둔청년 및 가족. 고립≥6개월, 은둔≥6개월, 최근 1주 경제활동 없음 등 세부기준 존재.
지원: 심리지원/정책 연계, 진로·취업역량, 대인관계/활동형·체험형, 온라인 상호작용, 생활습관 형성, 공동생활·방문상담, 부모교육·멘토양성.
신청: 포털 경로 및 설문·면접 후 선정. 문의: 02-6953-2520."
7,2025 서울시 취업날개 서비스 지원,일자리,구직 청년의 면접정장 무료대여(연간 최대 10회)를 지원하는 상시 사업.,https://job.seoul.go.kr/hmpg/main/main.do?sso=ok,18.0,39.0,null,null,null,서울 거주 확인(주민등록·추가 증빙),구직청년(고교졸업예정자~39세),null,"실제 회사 면접 참여 시에만 인정, 증빙 서류 필수(면접확인/통보자료)",물품대여,면접정장 무료 대여 연간 최대 10회,"대여기간 3박4일, 사업기간 2025-01-01~2025-12-31",운영기관 12개 지점(마이스윗인터뷰·열린옷장·체인지레이디·슈트갤러리·스완제이·야베스컬렉션·드림윙즈·종로신사·달콤정장)에서 대여,2025-01-01 ~ 2025-12-31,서울일자리포털 통합회원 가입 후 로그인하여 온라인 신청,"지점별 문의: 마이스윗인터뷰(영등포 0507-1412-3027, 천호 0507-1413-3027), 열린옷장(건대 02-6929-1020), 체인지레이디(왕십리·강남 02-6204-1517), 슈트갤러리(회기 02-363-6009), 야베스컬렉션(이수 02-1833-5389), 드림윙즈(홍대 02-547-4782), 달콤정장(성북 0507-1388-8420), 스완제이(노원 010-7578-7108, 신림 010-9808-7108), 종로신사(종로 02-743-1850)",1,"정책유형: 일자리. 대상: 서울 거주 만18~39세 구직청년. 내용: 면접정장 무료대여 연 10회, 3박4일. 신청: 서울일자리포털 온라인. 참여제한: 대학원/모의면접 불인정, 증빙 미제출 시 불가. 예산 2,123백만원. 운영 12개 지점."
8,2025 서울 매력일자리 참여자 모집,일자리,전문분야 현장경험을 쌓아 민간 일자리 취업을 목표로 하는 현장형 일경험·채용연계 프로그램.,null,18.0,null,null,null,null,서울시민,"현재 실업 상태, 근로계약 시작 전",null,null,일경험·채용연계,null,null,"서울일자리포털 공고 기준. 분야별 직무캠프·현장경험 운영, 민간일자리 채용 연계.",2025-01-06 ~ 2025-01-10,서울일자리포털(job.seoul.go.kr) → 서울매력일자리 모집공고에서 온라인 신청,null,2,"포스터 요약: 신청기간 2025.1.6~1.10, 참여대상 만18세 이상 서울시민 중 근로계약 시작 전 현재 실업 상태. ZOO 아카데미 통합체험과정 사례 표기."
9,2025 서울 청년 취업 멘토링 페스타,일자리,서울 청년 대상 오프라인 멘토링·특강·상담 등 일자리 연계 행사(청년정책 팝업스토어 연계).,null,18.0,39.0,null,null,null,서울 거주 권장(행사 세부 공고 기준),제한없음,null,null,멘토링·이벤트,null,행사 당일 진행(세부 일정 공고 참조),멘토링/상담/특강과 청년정책 팝업스토어 운영(카드뉴스 참고).,null,세부 안내 공고 페이지(서울청년포털·서울일자리포털) 참조,null,1,카드뉴스 요약: ‘2025 서울 청년 취업 멘토링 페스타 feat. 청년정책 팝업스토어’. 행사·프로그램 라인업 총정리 안내 이미지.
10,서울형 이음공제,생활·금융,"청년의 자산형성을 돕는 매칭 적립·공제 지원(근로소득 기반, 조건 충족 시 매칭·장려금 지급).",uploaded:/mnt/data/바로보기 - 붙임 1. 서울형 이음공제 사업 공고문.pdf,19,39,근로소득 기준(공고 기준),null,null,서울 거주 또는 서울 소재 사업장 근로(공고 기준),근로 중 청년(상세 요건 공고 참조),null,"저축기간·불입액 충족, 중도해지 제한 등",매칭적립·공제,본인 저축액에 시·기업 매칭(세부 금액 공고 참조),"저축기간(예: 1~3년, 공고 참조)",중도해지/자격상실 시 감액·환수 기준 존재,null,공고문 내 지정 포털/방문 접수,공고문의 사업 담당부서 연락처 참조,3,"서울형 이음공제 사업 개요 및 자격, 저축기간·매칭, 중도해지 규정 등(공고 PDF 참조)."
11,2025년 겨울 서울시 행정체험단,일자리,"서울시 실무 부서에서 단기간 행정 현장 체험 제공(시급 지급, 주휴 포함).",uploaded:/mnt/data/2025년 겨울 행정체험단 모집안내.pdf,18,34,null,null,null,서울 거주 또는 서울 소재 대학 재학(공고 기준),대학생·청년 등(세부 자격 공고 참조),null,"중복참여 제한, 학기 중/방학 구분 등",단기일경험·임금,서울형 생활임금 수준 시급(공고 기준),동계 방학 기간 중(예: 4~6주),"주5일 1일 8시간 원칙, 4대보험·주휴수당 적용 기준 공고 참조",null,서울일자리포털 또는 지정 시스템 온라인 신청,서울시 청년정책/일자리 부서,2,모집기간·배치부서·임금·근로조건 등은 첨부 공고문 참조.
12,강동구 미취업 청년 어학 및 자격시험 응시료 지원,교육·역량,강동구 거주 미취업 청년의 어학·자격시험 응시료를 지원하여 취업역량 강화.,uploaded:/mnt/data/강동구 미취업 청년 어학 및 자격시험 응시료 지원사업 공고.pdf,19,39,null,null,null,서울 강동구 거주,미취업,null,"중복·허위 신청 제한, 연간 회차 제한 가능",응시료지원,종목별/회차별 상한액(공고 참조),사업기간 내,사후정산 또는 바우처 방식 등(공고 기준),null,강동구청 또는 온라인 신청 시스템,강동구 담당 부서,1,지원대상·증빙서류·지원한도·제외대상 등 세부는 공고문 참조.
13,외로움 없는 서울,심리건강,시민의 외로움 해소·사회적 연결 강화를 위한 캠페인·상담·네트워킹·프로그램.,uploaded:/mnt/data/외로움 없는 서울.pdf,null,null,null,null,null,서울,null,null,null,상담·연계·캠페인,null,연중,"상담연계, 지역 네트워크 프로그램 등(자료 참조)",null,자료 내 안내 채널,서울시 관련 부서(자료 참조),1,외로움 완화 정책 브랜딩 자료 요약.
